{"analysis_version":"rerun-20260820","artifact_sha256":"28694a0dd32e09f71eb312a4ec2366dbf29aee7402f22eb439e0f4355ecde44b","created_at":"2026-08-19T07:24:22.995648Z","entries":[{"audio":{"has_track":true,"usable":true},"best_ranges":[{"end_seconds":8.01,"start_seconds":0.0}],"fingerprint":{"content_sha256":"2f9213d9132ae3f7b1a8831aa01ead0d402ea342f3e2f0de0dc374f7e824086a","mtime_ns":"1787123499378447906","size_bytes":235151960},"media_type":"video","path":"projects/table-mat-mix-v7/inputs/source/video/product/product_透明桌垫-无甲醛检测.MP4","probe":{"audio":{"bit_rate":1536000,"channel_layout":null,"channels":2,"codec":"pcm_s16be","sample_rate":48000},"audio_codec":"pcm_s16be","bit_rate":234858387,"bitrate_kbps":234858.4,"channels":2,"codec":"h264","duration_seconds":8.01,"file":"projects/table-mat-mix-v7/inputs/source/video/product/product_透明桌垫-无甲醛检测.MP4","file_size_bytes":235151960,"format_long_name":"QuickTime / MOV","format_name":"mov,mp4,m4a,3gp,3g2,mj2","fps":59.94,"resolution":"3840x2160","sample_rate":48000,"size_bytes":235151960,"stream_count":3},"quality_risks":[],"representative_frames":["analysis/source/2f9213d9132ae3f7b1a8831aa01ead0d402ea342f3e2f0de0dc374f7e824086a/frame_0001.jpg","analysis/source/2f9213d9132ae3f7b1a8831aa01ead0d402ea342f3e2f0de0dc374f7e824086a/frame_0002.jpg","analysis/source/2f9213d9132ae3f7b1a8831aa01ead0d402ea342f3e2f0de0dc374f7e824086a/frame_0003.jpg","analysis/source/2f9213d9132ae3f7b1a8831aa01ead0d402ea342f3e2f0de0dc374f7e824086a/frame_0004.jpg"],"scenes":[{"duration_seconds":8.01,"end_seconds":8.01,"index":0,"start_seconds":0.0}]},{"audio":{"has_track":true,"usable":true},"best_ranges":[{"end_seconds":8.51,"start_seconds":0.0}],"fingerprint":{"content_sha256":"aa1712278fe76e692c8418e856577196d2ee9711ceecf5fc9020a503db3c796a","mtime_ns":"1787123498964327777","size_bytes":235152256},"media_type":"video","path":"projects/table-mat-mix-v7/inputs/source/video/product/product_透明桌垫-桌角对齐-挤压不变形.MP4","probe":{"audio":{"bit_rate":1536000,"channel_layout":null,"channels":2,"codec":"pcm_s16be","sample_rate":48000},"audio_codec":"pcm_s16be","bit_rate":221059700,"bitrate_kbps":221059.7,"channels":2,"codec":"h264","duration_seconds":8.51,"file":"projects/table-mat-mix-v7/inputs/source/video/product/product_透明桌垫-桌角对齐-挤压不变形.MP4","file_size_bytes":235152256,"format_long_name":"QuickTime / MOV","format_name":"mov,mp4,m4a,3gp,3g2,mj2","fps":59.94,"resolution":"3840x2160","sample_rate":48000,"size_bytes":235152256,"stream_count":3},"quality_risks":[],"representative_frames":["analysis/source/aa1712278fe76e692c8418e856577196d2ee9711ceecf5fc9020a503db3c796a/frame_0001.jpg","analysis/source/aa1712278fe76e692c8418e856577196d2ee9711ceecf5fc9020a503db3c796a/frame_0002.jpg","analysis/source/aa1712278fe76e692c8418e856577196d2ee9711ceecf5fc9020a503db3c796a/frame_0003.jpg","analysis/source/aa1712278fe76e692c8418e856577196d2ee9711ceecf5fc9020a503db3c796a/frame_0004.jpg"],"scenes":[{"duration_seconds":8.51,"end_seconds":8.51,"index":0,"start_seconds":0.0}]},{"audio":{"has_track":true,"usable":true},"best_ranges":[{"end_seconds":6.51,"start_seconds":0.0}],"fingerprint":{"content_sha256":"0757a4784647644cba0ad60521011215085d1f8a634dd08509a4ddb017e35f74","mtime_ns":"1787123499712392269","size_bytes":201596648},"media_type":"video","path":"projects/table-mat-mix-v7/inputs/source/video/product/product_透明桌垫-自动铺开对齐.MP4","probe":{"audio":{"bit_rate":1536000,"channel_layout":null,"channels":2,"codec":"pcm_s16be","sample_rate":48000},"audio_codec":"pcm_s16be","bit_rate":247737816,"bitrate_kbps":247737.8,"channels":2,"codec":"h264","duration_seconds":6.51,"file":"projects/table-mat-mix-v7/inputs/source/video/product/product_透明桌垫-自动铺开对齐.MP4","file_size_bytes":201596648,"format_long_name":"QuickTime / MOV","format_name":"mov,mp4,m4a,3gp,3g2,mj2","fps":59.94,"resolution":"3840x2160","sample_rate":48000,"size_bytes":201596648,"stream_count":3},"quality_risks":[],"representative_frames":["analysis/source/0757a4784647644cba0ad60521011215085d1f8a634dd08509a4ddb017e35f74/frame_0001.jpg","analysis/source/0757a4784647644cba0ad60521011215085d1f8a634dd08509a4ddb017e35f74/frame_0002.jpg","analysis/source/0757a4784647644cba0ad60521011215085d1f8a634dd08509a4ddb017e35f74/frame_0003.jpg","analysis/source/0757a4784647644cba0ad60521011215085d1f8a634dd08509a4ddb017e35f74/frame_0004.jpg"],"scenes":[{"duration_seconds":6.51,"end_seconds":6.51,"index":0,"start_seconds":0.0}]},{"audio":{"has_track":true,"usable":true},"best_ranges":[{"end_seconds":9.51,"start_seconds":0.0}],"fingerprint":{"content_sha256":"ad38ded3aa91a16492c0997c173643a11da51b607c2eb2ce507467f02c91b87e","mtime_ns":"1787123500799038857","size_bytes":268707276},"media_type":"video","path":"projects/table-mat-mix-v7/inputs/source/video/product/product_透明桌垫-防刮.MP4","probe":{"audio":{"bit_rate":1536000,"channel_layout":null,"channels":2,"codec":"pcm_s16be","sample_rate":48000},"audio_codec":"pcm_s16be","bit_rate":226041872,"bitrate_kbps":226041.9,"channels":2,"codec":"h264","duration_seconds":9.51,"file":"projects/table-mat-mix-v7/inputs/source/video/product/product_透明桌垫-防刮.MP4","file_size_bytes":268707276,"format_long_name":"QuickTime / MOV","format_name":"mov,mp4,m4a,3gp,3g2,mj2","fps":59.94,"resolution":"3840x2160","sample_rate":48000,"size_bytes":268707276,"stream_count":3},"quality_risks":[],"representative_frames":["analysis/source/ad38ded3aa91a16492c0997c173643a11da51b607c2eb2ce507467f02c91b87e/frame_0001.jpg","analysis/source/ad38ded3aa91a16492c0997c173643a11da51b607c2eb2ce507467f02c91b87e/frame_0002.jpg","analysis/source/ad38ded3aa91a16492c0997c173643a11da51b607c2eb2ce507467f02c91b87e/frame_0003.jpg","analysis/source/ad38ded3aa91a16492c0997c173643a11da51b607c2eb2ce507467f02c91b87e/frame_0004.jpg"],"scenes":[{"duration_seconds":9.51,"end_seconds":9.51,"index":0,"start_seconds":0.0}]},{"audio":{"has_track":true,"usable":true},"best_ranges":[{"end_seconds":16.02,"start_seconds":0.0}],"fingerprint":{"content_sha256":"6c9a821063ba05af5f221f87f492a2dea74ffb407f829a55940909d430a7564d","mtime_ns":"1787123500404795818","size_bytes":436483256},"media_type":"video","path":"projects/table-mat-mix-v7/inputs/source/video/product/product_透明桌垫-防油易擦拭.MP4","probe":{"audio":{"bit_rate":1536000,"channel_layout":null,"channels":2,"codec":"pcm_s16be","sample_rate":48000},"audio_codec":"pcm_s16be","bit_rate":217969166,"bitrate_kbps":217969.2,"channels":2,"codec":"h264","duration_seconds":16.02,"file":"projects/table-mat-mix-v7/inputs/source/video/product/product_透明桌垫-防油易擦拭.MP4","file_size_bytes":436483256,"format_long_name":"QuickTime / MOV","format_name":"mov,mp4,m4a,3gp,3g2,mj2","fps":59.94,"resolution":"3840x2160","sample_rate":48000,"size_bytes":436483256,"stream_count":3},"quality_risks":[],"representative_frames":["analysis/source/6c9a821063ba05af5f221f87f492a2dea74ffb407f829a55940909d430a7564d/frame_0001.jpg","analysis/source/6c9a821063ba05af5f221f87f492a2dea74ffb407f829a55940909d430a7564d/frame_0002.jpg","analysis/source/6c9a821063ba05af5f221f87f492a2dea74ffb407f829a55940909d430a7564d/frame_0003.jpg","analysis/source/6c9a821063ba05af5f221f87f492a2dea74ffb407f829a55940909d430a7564d/frame_0004.jpg"],"scenes":[{"duration_seconds":16.02,"end_seconds":16.02,"index":0,"start_seconds":0.0}]},{"audio":{"has_track":true,"usable":true},"best_ranges":[{"end_seconds":7.51,"start_seconds":0.0}],"fingerprint":{"content_sha256":"114ffcd6f7c246bd48ddd96970c8e39e3ed4daa873dd3497cb88bddc36f336b2","mtime_ns":"1787123501124465116","size_bytes":201597236},"media_type":"video","path":"projects/table-mat-mix-v7/inputs/source/video/product/product_透明桌垫-餐桌场景.MP4","probe":{"audio":{"bit_rate":1536000,"channel_layout":null,"channels":2,"codec":"pcm_s16be","sample_rate":48000},"audio_codec":"pcm_s16be","bit_rate":214750717,"bitrate_kbps":214750.7,"channels":2,"codec":"h264","duration_seconds":7.51,"file":"projects/table-mat-mix-v7/inputs/source/video/product/product_透明桌垫-餐桌场景.MP4","file_size_bytes":201597236,"format_long_name":"QuickTime / MOV","format_name":"mov,mp4,m4a,3gp,3g2,mj2","fps":59.94,"resolution":"3840x2160","sample_rate":48000,"size_bytes":201597236,"stream_count":3},"quality_risks":[],"representative_frames":["analysis/source/114ffcd6f7c246bd48ddd96970c8e39e3ed4daa873dd3497cb88bddc36f336b2/frame_0001.jpg","analysis/source/114ffcd6f7c246bd48ddd96970c8e39e3ed4daa873dd3497cb88bddc36f336b2/frame_0002.jpg","analysis/source/114ffcd6f7c246bd48ddd96970c8e39e3ed4daa873dd3497cb88bddc36f336b2/frame_0003.jpg","analysis/source/114ffcd6f7c246bd48ddd96970c8e39e3ed4daa873dd3497cb88bddc36f336b2/frame_0004.jpg"],"scenes":[{"duration_seconds":7.51,"end_seconds":7.51,"index":0,"start_seconds":0.0}]}],"input_hashes":{"media_0":"2f9213d9132ae3f7b1a8831aa01ead0d402ea342f3e2f0de0dc374f7e824086a","media_1":"aa1712278fe76e692c8418e856577196d2ee9711ceecf5fc9020a503db3c796a","media_2":"0757a4784647644cba0ad60521011215085d1f8a634dd08509a4ddb017e35f74","media_3":"ad38ded3aa91a16492c0997c173643a11da51b607c2eb2ce507467f02c91b87e","media_4":"6c9a821063ba05af5f221f87f492a2dea74ffb407f829a55940909d430a7564d","media_5":"114ffcd6f7c246bd48ddd96970c8e39e3ed4daa873dd3497cb88bddc36f336b2"},"producer":"lib.media_index","project_id":"table-mat-mix-v7","semantic_sha256":"3c535880fdeb0d7b69497debc0e5e47b998c514ec446bd91d11b7e032d924362","version":"1.0"}